{
  "id": "ransomware-c2-block-v1",
  "name": "Ransomware: C2 Beacon Block",
  "description": "Triggered by C2 beaconing detections that match ransomware-family TTPs. Blocks C2 destinations at edge, isolates source host.",
  "version": "1.0.0",
  "tags": [
    "ransomware",
    "c2",
    "mitre.t1071"
  ],
  "trigger": {
    "on": "alert",
    "severity": [
      "critical"
    ],
    "tags": [
      "ransomware"
    ]
  },
  "author": "AiSOC",
  "enabled": true,
  "created_at": "2026-05-03T00:00:00+00:00",
  "updated_at": "2026-05-03T00:00:00+00:00",
  "steps": [
    {
      "id": "e1",
      "name": "Enrich destination IP",
      "type": "enrich",
      "params": {
        "indicator_field": "alert.dst_ip"
      },
      "on_failure": "continue",
      "retry_max": 0,
      "timeout_seconds": 30
    },
    {
      "id": "b1",
      "name": "Block C2 destination",
      "type": "block_ip",
      "params": {
        "ip_field": "alert.dst_ip",
        "duration": "30d"
      },
      "on_failure": "abort",
      "retry_max": 0,
      "timeout_seconds": 20
    },
    {
      "id": "iso",
      "name": "Isolate beaconing host",
      "type": "isolate_host",
      "params": {
        "host_field": "alert.host"
      },
      "on_failure": "abort",
      "retry_max": 0,
      "timeout_seconds": 30
    },
    {
      "id": "inv",
      "name": "Investigate ransomware C2",
      "type": "investigate",
      "params": {
        "case_id_field": "alert.case_id",
        "focus": "forensics"
      },
      "on_failure": "continue",
      "retry_max": 0,
      "timeout_seconds": 180
    },
    {
      "id": "n1",
      "name": "Notify SOC",
      "type": "notify",
      "params": {
        "channel": "slack",
        "message_template": "C2 {{alert.dst_ip}} blocked. Host {{alert.host}} isolated.",
        "webhook_env": "SLACK_SOC_WEBHOOK"
      },
      "on_failure": "continue",
      "retry_max": 0,
      "timeout_seconds": 10
    },
    {
      "id": "t1",
      "name": "Open C2 ticket",
      "type": "create_ticket",
      "params": {
        "priority": "P1",
        "title_template": "Ransomware C2: {{alert.host}} -> {{alert.dst_ip}}",
        "queue": "soc"
      },
      "on_failure": "continue",
      "retry_max": 0,
      "timeout_seconds": 20
    }
  ]
}
